{
  "id": "wcag-4.1.1-parsing",
  "sc": "4.1.1",
  "title": "Parsing (Obsolete)",
  "level": "A",
  "wcag_versions": [
    "2.0",
    "2.1"
  ],
  "applies_to": [
    "Document row"
  ],
  "check": {
    "type": "automated",
    "description": "Markup parses cleanly: no duplicate IDs, complete start/end tags, correct nesting. REMOVED in WCAG 2.2 (deemed always-satisfied by modern parsers); retained here for 2.0/2.1 mapping — the P-2 duplicate-ID probe is the practical consumer."
  },
  "severity": "minor",
  "sources": {
    "wcag_url": "https://www.w3.org/WAI/WCAG22/Understanding/parsing.html",
    "en301549_clause": "9.4.1.1",
    "internal_policy_ref": "HSBC digital accessibility framework — WCAG 2.2 AA minimum, governed by Group Digital Experience and Accessibility (mandatory on all HSBC digital projects)."
  }
}