{
  "id": "wcag-1.2.5-audio-description-prerecorded",
  "sc": "1.2.5",
  "title": "Audio Description (Prerecorded)",
  "level": "AA",
  "wcag_versions": [
    "2.0",
    "2.1",
    "2.2"
  ],
  "applies_to": [
    "Video player"
  ],
  "check": {
    "type": "manual",
    "description": "Prerecorded video content has an audio description."
  },
  "severity": "serious",
  "sources": {
    "wcag_url": "https://www.w3.org/WAI/WCAG22/Understanding/audio-description-prerecorded.html",
    "en301549_clause": "9.1.2.5",
    "internal_policy_ref": "HSBC digital accessibility framework — WCAG 2.2 AA minimum, governed by Group Digital Experience and Accessibility (mandatory on all HSBC digital projects)."
  }
}