{
  "id": "wcag-2.4.2-page-titled",
  "sc": "2.4.2",
  "title": "Page Titled",
  "level": "A",
  "wcag_versions": [
    "2.0",
    "2.1",
    "2.2"
  ],
  "applies_to": [
    "Template error"
  ],
  "check": {
    "type": "semi-automated",
    "description": "Web pages have titles that describe topic or purpose."
  },
  "severity": "serious",
  "sources": {
    "wcag_url": "https://www.w3.org/WAI/WCAG22/Understanding/page-titled.html",
    "en301549_clause": "9.2.4.2",
    "internal_policy_ref": "HSBC digital accessibility framework — WCAG 2.2 AA minimum, governed by Group Digital Experience and Accessibility (mandatory on all HSBC digital projects)."
  }
}