{
  "id": "wcag-1.4.4-resize-text",
  "sc": "1.4.4",
  "title": "Resize Text",
  "level": "AA",
  "wcag_versions": [
    "2.0",
    "2.1",
    "2.2"
  ],
  "applies_to": [
    "Avatar",
    "Search field"
  ],
  "check": {
    "type": "semi-automated",
    "description": "Text can be resized up to 200% without loss of content or function.",
    "threshold": "200%"
  },
  "severity": "serious",
  "sources": {
    "wcag_url": "https://www.w3.org/WAI/WCAG22/Understanding/resize-text.html",
    "en301549_clause": "9.1.4.4",
    "internal_policy_ref": "HSBC digital accessibility framework — WCAG 2.2 AA minimum, governed by Group Digital Experience and Accessibility (mandatory on all HSBC digital projects)."
  }
}